{
  "id": "SPIKES",
  "name": "Checkliste Gesprächsstruktur SPIKES — Diagnoseübermittlung Diabetes Mellitus Typ 1",
  "version": "1.0",
  "domain": "communication",
  "description": "Bewertet die Gesprächsstruktur nach dem SPIKES-Protokoll (Baile et al., 2000) anhand von 24 Items (davon 5 konditional). Version 1.0, 09-10-2025.",
  "reference": "Baile WF et al. SPIKES — A Six-Step Protocol for Delivering Bad News. Oncologist. 2000;5(4):302-311.",
  "scoring_preamble": "Allgemeine Skala:\n- 2 = Verhalten klar und vollständig im Transkript belegt\n- 1 = Verhalten erkennbar angedeutet, aber unvollständig oder nur teilweise umgesetzt\n- 0 = Verhalten fehlt oder nicht erkennbar\n- NA = Nur bei konditionalen Items wenn die Bedingung im Gespräch NICHT eingetreten ist\n\nIm Zweifelsfall zwischen zwei Stufen wähle die niedrigere. Score 2 erfordert einen positiven Transkriptbeleg — nicht nur die Abwesenheit eines Fehlers.\n\nABGRENZUNG:\nBewerte AUSSCHLIESSLICH die SPIKES-Gesprächsstruktur — ob die Phasen Setting / Perception / Invitation / Knowledge / Emotion / Summary umgesetzt wurden und in der richtigen Reihenfolge stattfanden.\nKommunikationsqualität (Empathie, Ausdrucksweise, Professionalität) → wird durch LUCAS bewertet, nicht durch SPIKES.\nKlinischer Inhalt (medizinische Korrektheit der Aussagen) → wird durch Diabetes_CC bewertet, nicht durch SPIKES.\n\nGESPRÄCHSKONTEXT:\n- SPEAKER_00 = Kliniker (zu bewerten)\n- SPEAKER_01 = Bezugsperson / Angehöriger (nicht zu bewerten)\n- Das Gespräch findet NICHT direkt mit dem Patienten statt, sondern mit der Bezugsperson.\n\nDIARISIERUNGSHINWEIS: Kurze Ein-Wort-Segmente wie 'Genau', 'Mhm', 'Ja', 'Okay' sind häufig falsch zugeordnet. Prüfe immer den Kontext des umgebenden Dialogs.",
  "passes": [
    {
      "id": "pass1",
      "name": "S-Phase — Setting",
      "type": "standard",
      "item_ids": [
        "DM_S_1",
        "DM_S_2",
        "DM_S_3",
        "DM_S_4",
        "DM_S_5"
      ],
      "template": "spikes_pass1.j2",
      "max_tokens": 4000,
      "context_requirements": {
        "transcript": "full",
        "phase_focus": "S-Phase (Setting up) — Gesprächsbeginn und Umgebungsgestaltung. Die S-Phase findet typischerweise am Anfang des Gesprächs statt, aber prüfe das gesamte Transkript auf S-Phase-Verhalten."
      }
    },
    {
      "id": "pass2",
      "name": "P-Phase — Perception",
      "type": "standard",
      "item_ids": [
        "DM_P_6",
        "DM_P_7",
        "DM_P_8"
      ],
      "template": "spikes_pass2.j2",
      "max_tokens": 4000,
      "context_requirements": {
        "transcript": "full",
        "phase_focus": "P-Phase (Perception) — Was weiß die Bezugsperson bereits? Offene Fragen zur Vorwahrnehmung, Erkennen und Korrigieren von Missverständnissen und unrealistischen Erwartungen."
      }
    },
    {
      "id": "pass3",
      "name": "I-Phase — Invitation",
      "type": "standard",
      "item_ids": [
        "DM_I_9"
      ],
      "template": "spikes_pass3.j2",
      "max_tokens": 3000,
      "context_requirements": {
        "transcript": "full",
        "phase_focus": "I-Phase (Invitation) — Informationswunsch besprechen. Hat der Kliniker explizit gefragt wie viel Information die Bezugsperson möchte?"
      }
    },
    {
      "id": "pass4",
      "name": "K-Phase — Knowledge",
      "type": "standard",
      "item_ids": [
        "DM_K_10",
        "DM_K_11",
        "DM_K_12",
        "DM_K_13",
        "DM_K_14"
      ],
      "template": "spikes_pass4.j2",
      "max_tokens": 5000,
      "context_requirements": {
        "transcript": "full",
        "phase_focus": "K-Phase (Knowledge) — Diagnosemitteilung und Informationsvermittlung. Wie wurde die schlechte Nachricht übermittelt? Sprache, Portionierung, Vorwarnung."
      }
    },
    {
      "id": "pass5",
      "name": "E-Phase — Empathy",
      "type": "standard",
      "item_ids": [
        "DM_E_15",
        "DM_E_16",
        "DM_E_17",
        "DM_E_18",
        "DM_E_19"
      ],
      "template": "spikes_pass5.j2",
      "max_tokens": 5000,
      "context_requirements": {
        "transcript": "full",
        "emotion_scan": true,
        "phase_focus": "E-Phase (Emotion) — Emotionale Reaktionen der Bezugsperson und empathische Reaktion des Klinikers. Führe zuerst einen vollständigen Emotionsscan durch."
      }
    },
    {
      "id": "pass6",
      "name": "S2-Phase — Strategy/Summary",
      "type": "standard",
      "item_ids": [
        "DM_S2_20",
        "DM_S2_21",
        "DM_S2_22",
        "DM_S2_23",
        "DM_S2_24"
      ],
      "template": "spikes_pass6.j2",
      "max_tokens": 4000,
      "context_requirements": {
        "transcript": "full",
        "phase_focus": "S2-Phase (Strategy/Summary) — Abschluss und nächste Schritte. Behandlungsplanung, Verständnissicherung, Zusammenfassung."
      }
    },
    {
      "id": "pass7",
      "name": "Sequenzprüfung",
      "type": "sequence_check",
      "item_ids": [],
      "template": "spikes_pass7.j2",
      "max_tokens": 2000,
      "context_requirements": {
        "transcript": "full"
      }
    }
  ],
  "items": [
    {
      "id": "DM_S_1",
      "name": "Ungestörtheit sicherstellen",
      "category": "S",
      "scale": [
        0,
        1,
        2
      ],
      "scale_labels": {
        "0": "Fehlt",
        "1": "Ansatz",
        "2": "Vollständig"
      },
      "description": "Kliniker stellt sicher dass das Gespräch ungestört stattfinden kann (Raum, Unterbrechungen minimiert, Handy stumm o.ä.).",
      "scoring_guidance": {
        "2": "Ungestörtheit explizit und erkennbar sichergestellt — konkreter Hinweis im Transkript (z.B. Tür schließen, Handy weglegen, Hinweis dass keine Unterbrechungen kommen) oder Setting-Beschreibung zeigt klare Maßnahmen.",
        "1": "Ansätze vorhanden aber unvollständig — z.B. kurze Erwähnung ohne konkrete Umsetzung, oder nur eine Maßnahme von mehreren notwendigen.",
        "0": "Keine erkennbaren Maßnahmen zur Sicherstellung der Ungestörtheit."
      },
      "evaluation_notes": [
        "In vielen Transkripten ist S1 schwer zu belegen da es setting-basiert ist — gib S1:2 wenn eindeutige Hinweise vorliegen.",
        "Implizite Hinweise wie 'Wir sitzen jetzt hier ruhig' oder eine störungsfreie Gesprächsatmosphäre können S1:1 begründen."
      ],
      "critical": false,
      "type": "standard"
    },
    {
      "id": "DM_S_2",
      "name": "Angehörige einbeziehen",
      "category": "S",
      "scale": [
        0,
        1,
        2
      ],
      "scale_labels": {
        "0": "Fehlt",
        "1": "Ansatz",
        "2": "Vollständig"
      },
      "description": "Kliniker bezieht anwesende Bezugspersonen aktiv in das Gespräch ein oder begrüßt sie.",
      "scoring_guidance": {
        "2": "Bezugsperson aktiv und explizit in das Gespraech einbezogen: Begruessung der Bezugsperson als Person (nicht nur als Anwesende) UND mindestens eine weitere aktive Einbeziehungsgeste (Rollenerklaerung, Einladung zur Teilnahme, direkte Adressierung eines Beitrags der Bezugsperson). Beide Elemente muessen vorhanden sein.",
        "1": "Nur Begruessung der Bezugsperson ohne weitere aktive Einbeziehung, ODER Bezugsperson gelegentlich angesprochen aber kein systematischer Einbezug.",
        "0": "Keine erkennbare Einbeziehung der Bezugsperson oder Bezugsperson vollständig ignoriert."
      },
      "evaluation_notes": [
        "Im Szenario ist SPEAKER_01 bereits die einzige Gesprächspartnerin — 'Einbeziehen' bedeutet aktive Anerkennung ihrer Rolle.",
        "Score 2 wenn Kliniker SPEAKER_01 explizit als Gesprächspartner addressiert und einbezieht."
      ],
      "critical": false,
      "type": "standard"
    },
    {
      "id": "DM_S_3",
      "name": "Hinsetzen / Barrieren beseitigen",
      "category": "S",
      "scale": [
        0,
        1,
        2
      ],
      "scale_labels": {
        "0": "Fehlt",
        "1": "Ansatz",
        "2": "Vollständig"
      },
      "description": "Kliniker setzt sich (Augenhöhe herstellen, physische Barrieren beseitigen).",
      "scoring_guidance": {
        "2": "Hinsetzen oder Augenhöhe explizit erkennbar — z.B. Transkripthinweis, oder Videometriken bestätigen sitzende Position auf Augenhöhe.",
        "1": "Ansatz erkennbar aber nicht vollständig sicher (z.B. unklar ob sitzend oder stehend).",
        "0": "Keine Hinweise auf körperliche Annäherung oder Augenhöhe; oder Kliniker offensichtlich stehend/distanziert."
      },
      "evaluation_notes": [
        "S3 ist in reinen Transkripten schwer zu belegen — nutze Kontexthinweise.",
        "Bei fehlenden Videodaten: Score 1 als Standard wenn keine Hinweise auf das Gegenteil vorliegen."
      ],
      "critical": false,
      "type": "standard"
    },
    {
      "id": "DM_S_4",
      "name": "Verbindung herstellen",
      "category": "S",
      "scale": [
        0,
        1,
        2
      ],
      "scale_labels": {
        "0": "Fehlt",
        "1": "Ansatz",
        "2": "Vollständig"
      },
      "description": "Kliniker stellt Rapport her — persönliche Verbindung, Name verwendet, Augenkontakt, kurzer Small Talk oder direkte Zuwendung.",
      "scoring_guidance": {
        "2": "Rapport erkennbar aufgebaut — mindestens eines der folgenden klar vorhanden: (a) Bezugsperson beim Namen angesprochen (nicht nur im Ritual der Begruessung), (b) kurze persoenliche Anmerkung oder warmherzige Einleitung vor dem sachlichen Gespraechseinstieg, (c) explizite empathische Geste beim Einstieg. Ein einziger genuiner Rapport-Moment genuegt.",
        "1": "Nur routinehafte Begruessung ohne erkennbaren Rapport-Aufbau (z.B. 'Guten Tag, ich bin Dr. Mayer'), oder Namensverwendung lediglich im Kontext der Begruessung ohne weitere Zuwendung.",
        "0": "Kein erkennbarer Rapport-Aufbau; Gespräch beginnt sofort sachlich ohne persönliche Zuwendung."
      },
      "evaluation_notes": [